<?xml version="1.0" encoding="UTF-8"?>
<!DOCTYPE catalog SYSTEM "BookML.dtd" >
<catalog>
  <bookList>
    <book id ="isbn-895468000-3" categories="c101-1-1">
      <title>방금 떠나온 세계</title>
      <author>김초엽</author>
      <publisher>publisher</publisher>
      <publishDate year="2015" month="01" day="01">출판일</publishDate>
      <revisionDate year="2023" month="02" day="28"></revisionDate>
      <price currency="won">
        <listPrice>가격</listPrice>
        <salesPrice discountRate="10">salesPrice</salesPrice>
      </price>
      <pages>276</pages>
      <rating>10.0</rating>
      <coverArt src="https://contents.kyobobook.co.kr/sih/fit-in/458x0/pdt/9791160406504.jpg"></coverArt>
      <bookIntroduction>책소개</bookIntroduction>
      <review>책 리뷰</review>
    </book>
    <ebook id="isbn-9788934971351" categories="c102-1">
    	<title>철학은 날씨를 바꾼다.</title>
    	<author>서동욱</author>
    	<publisher>&publish;</publisher> <!-- (나)#3 built-in entity 사용-->
    	<publishDate year="2012" month="03" day="01"></publishDate>
    	<revisionDate year="2024" month="04" day="17"></revisionDate>
    	<price currency="won">
    		<listPrice>10000</listPrice>
    		<salesPrice discountRate="20"></salesPrice>
    	</price>
    	<pages>343</pages>
    	<rating>9.8</rating>
    	<coverArt src="https://contents.kyobobook.co.kr/sih/fit-in/458x0/pdt/9788934971351.jpg"></coverArt>
    	<bookIntroduction>하하</bookIntroduction>
    	<review>이동진 책 추천으로 구매합니다</review>
    	<format value="PDF"></format>
    	<size unit="MB"></size>
    </ebook>
    <newEbook id="isbn-9788954675338" categories="c102-1">
    	<title>&lt;복자에게&gt;</title> <!-- (나)#3 기타 요구사항_built in entity 한 번 이상 사용함 -->
    	<author>김금희</author>
    	<publisher>문학동네</publisher>
    	<publishDate year="2012" month="03" day="01"></publishDate>
    	<price currency="won">
    		<listPrice>100</listPrice>
    		<salesPrice discountRate="20"></salesPrice>
    	</price>
    	<pages>44</pages>
    	<rating>9.0</rating>
    	<coverArt src="https://contents.kyobobook.co.kr/sih/fit-in/458x0/pdt/9788954674492.jpg"></coverArt>
    	<bookIntroduction>책소개</bookIntroduction>
    	<review>구매합니다</review>
    	<format value="PDF"></format>
    	<size unit="MB"></size>
    </newEbook>
  </bookList>
  <bookCategory>
    <category cid="c101" name="문학">
    	<category cid="c101-1" name="소설"></category>
    	<category cid="c101-1-1" name="한국소설"></category>
  	</category>
  	<category cid="c102" name="인문">
  		<category cid="c102-1" name="철학"></category>
  	</category>
</bookCategory>
</catalog>
